{
  "$schema": "https://json-schema.org/draft/2020-12/schema",
  "$id": "https://devs.new/schemas/agent.schema.json",
  "title": "Agent Definition",
  "description": "Schema for defining AI agents with their roles, instructions, and configuration",
  "type": "object",
  "properties": {
    "id": {
      "type": "string",
      "description": "Unique identifier for the agent",
      "pattern": "^[a-z0-9-]+$",
      "minLength": 1
    },
    "icon": {
      "type": "string",
      "description": "Optional icon name for the agent, used for UI representation. Must be a valid icon name from the Iconoir icon set."
    },
    "name": {
      "type": "string",
      "description": "Display name of the agent",
      "minLength": 1
    },
    "role": {
      "type": "string",
      "description": "Brief description of the agent's role and specialization",
      "minLength": 1
    },
    "instructions": {
      "type": "string",
      "description": "Detailed instructions for the agent's behavior, capabilities, and approach",
      "minLength": 1
    },
    "temperature": {
      "type": "number",
      "description": "Temperature parameter for LLM responses (0.0 to 2.0)",
      "minimum": 0.0,
      "maximum": 2.0
    },
    "tags": {
      "type": "array",
      "description": "Tags for categorizing and searching agents",
      "items": {
        "type": "string",
        "minLength": 1
      },
      "uniqueItems": true
    }
  },
  "required": ["id", "name", "role", "instructions"],
  "additionalProperties": false
}
